{
  "library": {
    "name": "stately",
    "npm": "stately.js",
    "homepage": "https://github.com/fschaefer/Stately.js",
    "languages": ["javascript"]
  },
  "machine": "toggle",
  "language": "javascript",
  "official": false,
  "canImplement": true,
  "source": {
    "url": "https://github.com/fschaefer/Stately.js#examples",
    "note": "Stately did not have a light switch example. I made this from the readme, whose actions return the next state by name."
  },
  "code": "export const toggleMachine = Stately.machine({\n  inactive: {\n    toggle: () => \"active\",\n  },\n  active: {\n    toggle: () => \"inactive\",\n  },\n});",
  "formattedWith": "prettier"
}
