{
  "library": {
    "name": "stately",
    "npm": "stately.js",
    "homepage": "https://github.com/fschaefer/Stately.js",
    "languages": ["javascript"]
  },
  "machine": "matter",
  "language": "javascript",
  "official": false,
  "canImplement": true,
  "source": {
    "url": "https://github.com/fschaefer/Stately.js#examples",
    "note": "stately did not have a states of matter example. I made this from the readme, whose actions return the next state by name."
  },
  "code": "export const matter = Stately.machine({\n  solid: {\n    melt: () => {\n      console.log(\"I melted\");\n      return \"liquid\";\n    },\n  },\n  liquid: {\n    freeze: () => {\n      console.log(\"I froze\");\n      return \"solid\";\n    },\n    vaporize: () => {\n      console.log(\"I vaporized\");\n      return \"gas\";\n    },\n  },\n  gas: {\n    condense: () => {\n      console.log(\"I condensed\");\n      return \"liquid\";\n    },\n  },\n});",
  "formattedWith": "prettier"
}
